{
  "approval_events": [
    {
      "actor": null,
      "source_event_id": "af632bd8-fa5c-4160-ad2a-963b2563cf4c",
      "status": "unknown",
      "subject": "pipeline.complete"
    }
  ],
  "artifact_diffs": [],
  "artifact_hashes": [
    {
      "hash": "a0e79a837c36256c8c0b744153601488ebf937a8af006572345eeacba3c6a8b6",
      "ref": "briefs/2026-W22/brief.md"
    },
    {
      "hash": "133c548c7f183f5b956d7f14435a1f3ed31d413a583837ec6b5d0c8422d07304",
      "ref": "briefs/2026-W22/meta.yaml"
    }
  ],
  "artifact_refs": [
    {
      "artifact_id": "briefs/2026-W22/brief.md",
      "kind": "brief",
      "ref": "briefs/2026-W22/brief.md"
    },
    {
      "artifact_id": "briefs/2026-W22/meta.yaml",
      "kind": "meta",
      "ref": "briefs/2026-W22/meta.yaml"
    }
  ],
  "cost_usage": null,
  "event_log_hash": "1c997f6961cdcf11ac242dc24dc65a68e8a274eaf7739b605f08bb9b3e772f8b",
  "event_log_ref": "../ai-field-brief/ops/event-ledger/run-7131f5246462.jsonl",
  "gate_results": [
    {
      "name": "voice_lint",
      "source_event_id": "89d397bc-4083-4fdb-a7fa-40b78834885a",
      "status": "passed",
      "summary": null
    },
    {
      "name": "spec_check",
      "source_event_id": "0e52e4dd-dbf6-484f-b4b1-954900382086",
      "status": "passed",
      "summary": null
    },
    {
      "name": "check_no_bom",
      "source_event_id": "3b86f956-60c4-4e3b-a56b-42778881197e",
      "status": "passed",
      "summary": null
    },
    {
      "name": "validate_schemas",
      "source_event_id": "316ae5a3-7530-4923-b026-f52e3d7e0736",
      "status": "passed",
      "summary": null
    },
    {
      "name": "validate_registry",
      "source_event_id": "2182e78a-24a1-4875-8459-08060976900e",
      "status": "passed",
      "summary": null
    },
    {
      "name": "validate_decisions",
      "source_event_id": "b30acd09-2c1b-4f68-9f33-e2add5465895",
      "status": "passed",
      "summary": null
    },
    {
      "name": "validate_roles",
      "source_event_id": "0bc10b85-9302-44bb-958e-4ed57526f1e6",
      "status": "passed",
      "summary": null
    },
    {
      "name": "validate_tools",
      "source_event_id": "ce616918-cdce-47ea-b83a-0707704988f8",
      "status": "passed",
      "summary": null
    },
    {
      "name": "validate_policies",
      "source_event_id": "bc2e8976-6103-43fe-9adf-a4810798079a",
      "status": "passed",
      "summary": null
    },
    {
      "name": "validate_skills",
      "source_event_id": "1ebdbc51-6e0b-41e2-a4df-fcf3c2747904",
      "status": "passed",
      "summary": null
    },
    {
      "name": "validate_dreams",
      "source_event_id": "647d9898-2f5c-408a-a1e4-75bea9fb512d",
      "status": "passed",
      "summary": null
    },
    {
      "name": "check_schema_cache_freshness",
      "source_event_id": "d32da2ed-ba3c-44ad-8c43-6e8953cf1547",
      "status": "passed",
      "summary": null
    },
    {
      "name": "gate.run.evidence_recorded",
      "source_event_id": "ee647741-ef33-4340-ab3c-5f78be79234b",
      "status": "unknown",
      "summary": null
    }
  ],
  "generated_at": "2026-05-28T11:45:47Z",
  "input_refs": [
    {
      "description": "CDCP event log input",
      "hash": "sha256:1c997f6961cdcf11ac242dc24dc65a68e8a274eaf7739b605f08bb9b3e772f8b",
      "kind": "event-log",
      "uri": "E:/claude_code/random-apps/ai-field-brief/ops/event-ledger/run-7131f5246462.jsonl"
    }
  ],
  "mcp_servers": [],
  "model": null,
  "notes": [
    "Generated from CDCP event log + producer Run record; refs and hashes preserve provenance."
  ],
  "policy_decisions": [],
  "producer_run_id": "run-7131f5246462",
  "prompt_snapshot_hash": "b0f549651e7d4d23907038bf53d431ba2d2db4a3a4172ef56b0e5fb9cd25fcf7",
  "rollback_refs": [],
  "run_id": "run-7131f5246462",
  "run_record_hash": "2f7a3272968cea06c509dd20d911aa2a5202e797f00a902494001b7b8bd0e9da",
  "run_record_ref": "../ai-field-brief/ops/run-records/run-7131f5246462.json",
  "runtime_provider": "cdcp-event-log",
  "sandbox_image_ref": "E:/claude_code/random-apps/ai-field-brief@23a3efd6fb676bf903fbd0b282708f663c24d923",
  "schema_version": "2.0.0",
  "tool_calls": [],
  "tool_schemas_snapshot_hash": "32b4ee1bba905ea25e36325eca2240c3ebdc83c928663fe287e03c2bc36d0501",
  "trace_refs": []
}
