{
  "approval_events": [
    {
      "actor": null,
      "source_event_id": "15b68059-0336-4c72-af48-3f67db5cd5e6",
      "status": "unknown",
      "subject": "tool.call.completed"
    },
    {
      "actor": null,
      "source_event_id": "c1c837d4-74e8-4371-a3ba-74af67b45f60",
      "status": "unknown",
      "subject": "pipeline.done"
    }
  ],
  "artifact_diffs": [],
  "cost_usage": null,
  "event_log_hash": "6c749bd44b8db18e165bf1b664a35e94529d0dedefda26bee5ca208390349a30",
  "event_log_ref": "../supplier-risk-rag-agent/ops/event-ledger/run-2eab3c611b6a.jsonl",
  "gate_results": [
    {
      "name": "refusal_precision_threshold",
      "source_event_id": "4b916939-cdb6-48c8-8c1f-c5bfbe5f2a38",
      "status": "passed",
      "summary": null
    },
    {
      "name": "gate.run.evidence_recorded",
      "source_event_id": "aa3b0261-467a-43c8-ba41-f083b0693726",
      "status": "unknown",
      "summary": null
    }
  ],
  "generated_at": "2026-05-28T11:46:24Z",
  "input_refs": [
    {
      "description": "CDCP event log input",
      "hash": "sha256:6c749bd44b8db18e165bf1b664a35e94529d0dedefda26bee5ca208390349a30",
      "kind": "event-log",
      "uri": "E:/claude_code/random-apps/supplier-risk-rag-agent/ops/event-ledger/run-2eab3c611b6a.jsonl"
    }
  ],
  "mcp_servers": [],
  "model": null,
  "notes": [
    "Generated from CDCP event log + producer Run record; refs and hashes preserve provenance."
  ],
  "policy_decisions": [],
  "producer_run_id": "run-2eab3c611b6a",
  "prompt_snapshot_hash": "39c8c12b83a75b82aede7425dc3196c415c20b48c047f0f4cb79c7354f9c441b",
  "rollback_refs": [],
  "run_id": "run-2eab3c611b6a",
  "run_record_hash": "9a72f9a65b809d1a9697434f7be3e97620fe1df67ce8a4b0f4dee5e9ff3ae51f",
  "run_record_ref": "../supplier-risk-rag-agent/ops/run-records/run-2eab3c611b6a.json",
  "runtime_provider": "cdcp-event-log",
  "sandbox_image_ref": "E:/claude_code/random-apps/supplier-risk-rag-agent@1d24cc1ae360eba426ec5c6365c3ab12d16c8d0a",
  "schema_version": "2.0.0",
  "tool_calls": [
    {
      "decision": "unknown",
      "name": "agent.answer+refusal.decision",
      "server": null,
      "source_event_id": "15b68059-0336-4c72-af48-3f67db5cd5e6"
    }
  ],
  "tool_schemas_snapshot_hash": "e08826891cebceb4cf181a4195bc19558d503a83adf7b7c73cd7a6d43fb0b157",
  "trace_refs": []
}
