{
  "approval_events": [
    {
      "actor": null,
      "source_event_id": "571bf906-b19d-45ab-9f4d-b78c918c0da5",
      "status": "unknown",
      "subject": "pipeline.complete"
    }
  ],
  "artifact_diffs": [],
  "artifact_hashes": [
    {
      "hash": "fb9a737c8d770ccf869153fbc2f3c16d0660fb6776cec6f1d2d2867c482d2318",
      "ref": "briefs/2026-W20/brief.md"
    },
    {
      "hash": "88f04beabf9cc6305d7c30465da19cc7371703b10e926cbb5232d8d61723ad8e",
      "ref": "briefs/2026-W20/meta.yaml"
    }
  ],
  "artifact_refs": [
    {
      "artifact_id": "briefs/2026-W20/brief.md",
      "kind": "brief",
      "ref": "briefs/2026-W20/brief.md"
    },
    {
      "artifact_id": "briefs/2026-W20/meta.yaml",
      "kind": "meta",
      "ref": "briefs/2026-W20/meta.yaml"
    }
  ],
  "cost_usage": null,
  "event_log_hash": "ef427b23039f46298efaa4ee15a9ce1222c81498d69d0d793854b082e97aef4c",
  "event_log_ref": "../ai-field-brief/ops/event-ledger/run-874c5e341e13.jsonl",
  "gate_results": [
    {
      "name": "voice_lint",
      "source_event_id": "4f658b3d-f424-449b-acc3-933420f422b6",
      "status": "passed",
      "summary": null
    },
    {
      "name": "spec_check",
      "source_event_id": "a4d8c66f-0cbf-4d32-b50c-6714ba220cc6",
      "status": "passed",
      "summary": null
    },
    {
      "name": "check_no_bom",
      "source_event_id": "525cc322-fd12-4e92-bba5-c76eca352c9f",
      "status": "passed",
      "summary": null
    },
    {
      "name": "validate_schemas",
      "source_event_id": "c84426ea-85c9-4a8f-8705-0cb089423c2d",
      "status": "passed",
      "summary": null
    },
    {
      "name": "validate_registry",
      "source_event_id": "b18b39b4-514b-49ad-82bb-6d35fe1addb4",
      "status": "passed",
      "summary": null
    },
    {
      "name": "validate_decisions",
      "source_event_id": "0f3ab249-5d29-4214-83fb-079539a63034",
      "status": "passed",
      "summary": null
    },
    {
      "name": "validate_roles",
      "source_event_id": "f4db9a6f-f1b9-405c-8c4a-8f701937bb27",
      "status": "passed",
      "summary": null
    },
    {
      "name": "validate_tools",
      "source_event_id": "3a4ed4bd-f071-4387-9c5e-ea63ffedea43",
      "status": "passed",
      "summary": null
    },
    {
      "name": "validate_policies",
      "source_event_id": "11a88933-77b4-4284-8e55-430d91a00f6c",
      "status": "passed",
      "summary": null
    },
    {
      "name": "validate_skills",
      "source_event_id": "57ec1cc4-bb68-4487-8ab4-9dabaaecde80",
      "status": "passed",
      "summary": null
    },
    {
      "name": "validate_dreams",
      "source_event_id": "72294721-04e0-488b-a7c1-df8a44e79529",
      "status": "passed",
      "summary": null
    },
    {
      "name": "check_schema_cache_freshness",
      "source_event_id": "581a03ae-f17d-4d87-b683-f19bd8590c5a",
      "status": "passed",
      "summary": null
    },
    {
      "name": "gate.run.evidence_recorded",
      "source_event_id": "60149540-63c0-44d3-8bc6-d8b774dcb219",
      "status": "unknown",
      "summary": null
    }
  ],
  "generated_at": "2026-05-28T11:45:47Z",
  "input_refs": [
    {
      "description": "CDCP event log input",
      "hash": "sha256:ef427b23039f46298efaa4ee15a9ce1222c81498d69d0d793854b082e97aef4c",
      "kind": "event-log",
      "uri": "E:/claude_code/random-apps/ai-field-brief/ops/event-ledger/run-874c5e341e13.jsonl"
    }
  ],
  "mcp_servers": [],
  "model": null,
  "notes": [
    "Generated from CDCP event log + producer Run record; refs and hashes preserve provenance."
  ],
  "policy_decisions": [],
  "producer_run_id": "run-874c5e341e13",
  "prompt_snapshot_hash": "b0f549651e7d4d23907038bf53d431ba2d2db4a3a4172ef56b0e5fb9cd25fcf7",
  "rollback_refs": [],
  "run_id": "run-874c5e341e13",
  "run_record_hash": "da5d650381c1f3b286a3d71a7e21979f1f7afcbfb31a0880e5adf1198f15f4c3",
  "run_record_ref": "../ai-field-brief/ops/run-records/run-874c5e341e13.json",
  "runtime_provider": "cdcp-event-log",
  "sandbox_image_ref": "E:/claude_code/random-apps/ai-field-brief@418baac0b9ade8f1e2e3841d5593a2c7672d6e1e",
  "schema_version": "2.0.0",
  "tool_calls": [],
  "tool_schemas_snapshot_hash": "32b4ee1bba905ea25e36325eca2240c3ebdc83c928663fe287e03c2bc36d0501",
  "trace_refs": []
}
